<?xml version="1.0" encoding="ISO-8859-1"?>
<!DOCTYPE clientes SYSTEM "clientes.dtd">
<clientes>
    <sede codigo="W1385400">
        <direccion>calle falsa numero 123</direccion>
        <direccion>calle falsa numero 321</direccion>
        <empleado>Juan Carmona</empleado>
        <fechaAlta>10-15-2020</fechaAlta>
        <descripcion>solvente</descripcion>
        <cliente codigo="AAA-548">
            <numeroViviendas>1</numeroViviendas>
            <coste>50000</coste>
            <resumen>vivienda de tres habitaciones</resumen>
            <plazo>16-11-2022</plazo>
        </cliente>
    </sede>
</clientes>